<?xml version="1.0" encoding="UTF-8" standalone="no"?>
<!DOCTYPE tests SYSTEM "tests.dtd">
<tests>
  <test title="Create and remove">
    <scenario id="scenario0" title="Create" type="person:create">
      <property name="firstName" value="Alex"/>
      <property name="lastName" value="Estporsky"/>
      <property name="age" value="21"/>
      <property name="gender" value="Male"/>
    </scenario>
    <scenario id="scenario1" title="Delete" type="person:delete">
      <property name="id" value="scenario0.id"/>
    </scenario>
  </test>
  <test title="Create female">
    <scenario id="scenario0" title="Create" type="person:create">
      <property name="firstName" value="Mary"/>
      <property name="lastName" value="Jhonson"/>
      <property name="age" value="31"/>
      <property name="gender" value="Female"/>
    </scenario>
  </test>
</tests>
